id,title,score,num_comments,author,created_utc,url,over_18,edited,spoiler,stickied
1k9wng3,Several unavoidable for loops are slowing this PySpark code. Is it possible to improve it?,42,22,rotterdamn8,2025-04-28 14:17:28,https://i.redd.it/jyf7vzym3lxe1.png,False,False,False,False
1k9s354,How are things hosted IRL?,28,8,Top-Statistician5848,2025-04-28 10:18:16,https://www.reddit.com/r/dataengineering/comments/1k9s354/how_are_things_hosted_irl/,False,False,False,False
1k9t0ms,Is Starting as a Data Engineer a Good Path to Become an ML Engineer Later?,24,30,MazenMohamed1393,2025-04-28 11:17:00,https://www.reddit.com/r/dataengineering/comments/1k9t0ms/is_starting_as_a_data_engineer_a_good_path_to/,False,False,False,False
1k9zvt5,dbt MCP Server – Bringing Structured Data to AI Workflows and Agents,20,1,andersdellosnubes,2025-04-28 16:30:45,https://docs.getdbt.com/blog/introducing-dbt-mcp-server,False,False,False,False
1ka7j43,Has getting job in data analytics got harder or it’s only me?,11,4,vegaslikeme1,2025-04-28 21:45:25,https://www.reddit.com/r/dataengineering/comments/1ka7j43/has_getting_job_in_data_analytics_got_harder_or/,False,False,False,False
1ka0tpe,Efficiently Storing and Querying OTEL Traces with Parquet,3,0,PutHuge6368,2025-04-28 17:09:47,https://www.reddit.com/r/dataengineering/comments/1ka0tpe/efficiently_storing_and_querying_otel_traces_with/,False,False,False,False
1k9zpb0,How well positioned am I to enter the Data Engineering job market? Where can I improve?,3,17,According-Clerk6559,2025-04-28 16:23:19,https://www.reddit.com/r/dataengineering/comments/1k9zpb0/how_well_positioned_am_i_to_enter_the_data/,False,False,False,False
1k9zbyh,How do I get out of consulting?,6,7,CD8_PerfectTCell99,2025-04-28 16:08:21,https://www.reddit.com/r/dataengineering/comments/1k9zbyh/how_do_i_get_out_of_consulting/,False,False,False,False
1k9x46i,Open source orchestration or workflow platforms with native NATS support,2,2,FickleLife,2025-04-28 14:37:33,https://www.reddit.com/r/dataengineering/comments/1k9x46i/open_source_orchestration_or_workflow_platforms/,False,False,False,False
1ka61fg,"How to handle modeling source system data based on date ""ranges""",3,0,jardata,2025-04-28 20:42:35,https://www.reddit.com/r/dataengineering/comments/1ka61fg/how_to_handle_modeling_source_system_data_based/,False,False,False,False
1k9o614,"Benchmarking Volga’s On-Demand Compute Layer for Feature Serving: Latency, RPS, and Scalability on EKS",4,0,saws_baws_228,2025-04-28 05:33:31,https://www.reddit.com/r/dataengineering/comments/1k9o614/benchmarking_volgas_ondemand_compute_layer_for/,False,False,False,False
1k9lzw6,Built a Synthetic Patient Dataset for Rheumatic Diseases. Now Live!,3,0,_loading-comment_,2025-04-28 03:22:38,https://www.leukotech.com/data,False,False,False,False
1ka3a7b,Doubt about the coexistence of different partitioning methods,2,6,dagovengo,2025-04-28 18:48:38,https://www.reddit.com/r/dataengineering/comments/1ka3a7b/doubt_about_the_coexistence_of_different/,False,False,False,False
1k9xbqo,Handling really inefficient partitioning,2,6,Wrench-Emoji8,2025-04-28 14:46:24,https://www.reddit.com/r/dataengineering/comments/1k9xbqo/handling_really_inefficient_partitioning/,False,False,False,False
1k9wffj,Full Stack Gen AI Engineer,2,1,Shy_analyst117,2025-04-28 14:07:53,https://www.reddit.com/r/dataengineering/comments/1k9wffj/full_stack_gen_ai_engineer/,False,False,False,False
1kaacbf,Looking for Advice: Breaking into Data Engineering,1,2,Historical_General_2,2025-04-28 23:54:29,https://www.reddit.com/r/dataengineering/comments/1kaacbf/looking_for_advice_breaking_into_data_engineering/,False,False,False,False
1kaaac1,How crazy is it to go full 6NF and Anchor Model?,4,6,HelpfulConclusion131,2025-04-28 23:51:45,https://www.reddit.com/r/dataengineering/comments/1kaaac1/how_crazy_is_it_to_go_full_6nf_and_anchor_model/,False,False,False,False
1ka6x9d,Apache Iceberg Clustering: Technical Blog,1,0,AMDataLake,2025-04-28 21:19:36,https://www.dremio.com/blog/dremios-apache-iceberg-clustering-technical-blog/?utm_source=reddit&utm_medium=influencer&utm_campaign=iceberg&utm_term=icebergclusteringtech-04-28-2025&utm_content=alexmerced,False,False,False,False
1ka2o0t,Data Quality with SAP?,1,0,JonasHaus,2025-04-28 18:23:14,https://www.reddit.com/r/dataengineering/comments/1ka2o0t/data_quality_with_sap/,False,False,False,False
1k9txeg,How can I set up metastore on K8s cluster?,1,1,Vw-Bee5498,2025-04-28 12:07:53,https://www.reddit.com/r/dataengineering/comments/1k9txeg/how_can_i_set_up_metastore_on_k8s_cluster/,False,False,False,False
1k9tgkq,27 Databases and same Model - ETL,1,5,ImortalDoryan,2025-04-28 11:42:22,https://www.reddit.com/r/dataengineering/comments/1k9tgkq/27_databases_and_same_model_etl/,False,False,False,False
1ka3llv,What’s Your Experience with System Integration Solutions?,0,1,AlternativeTough9168,2025-04-28 19:01:19,https://www.reddit.com/r/dataengineering/comments/1ka3llv/whats_your_experience_with_system_integration/,False,False,False,False
1k9y4zj,Iam looking for opnions about my edited dashboard,1,13,Ok-Watercress-451,2025-04-28 15:20:13,https://www.reddit.com/gallery/1k9y4zj,False,False,False,False
1k9nkwm,Beginner question: I am often stuck but I am not sure what knowledge gap I am lacking,0,3,Zacarinooo,2025-04-28 04:56:00,https://www.reddit.com/r/dataengineering/comments/1k9nkwm/beginner_question_i_am_often_stuck_but_i_am_not/,False,False,False,False
1k9inrg,Help building an econometric model to predict institutional vs retail investor orders/trades,0,1,Tanknspankn,2025-04-28 00:22:49,https://www.reddit.com/r/dataengineering/comments/1k9inrg/help_building_an_econometric_model_to_predict/,False,False,False,False
1k9u37z,Group-Project Assistance (Data-Insight-Generator),0,0,Mc_kelly,2025-04-28 12:16:43,https://www.reddit.com/r/dataengineering/comments/1k9u37z/groupproject_assistance_datainsightgenerator/,False,False,False,False
1k9r4s6,I am building an agentic Python coding copilot for data analysis and would like to hear your feedback,0,6,davidl002,2025-04-28 09:09:53,https://www.reddit.com/r/dataengineering/comments/1k9r4s6/i_am_building_an_agentic_python_coding_copilot/,False,False,False,False
