id,title,score,num_comments,author,created_utc,url,over_18,edited,spoiler,stickied
1kc2mff,Guess skills are not transferable,379,96,vitocomido,2025-05-01 07:04:03,https://i.redd.it/p8t4uyicd4ye1.jpeg,False,False,False,False
1kbmyhk,What book after Fundamentals of Data Engineering?,64,17,Khazard42o,2025-04-30 17:59:00,https://www.reddit.com/r/dataengineering/comments/1kbmyhk/what_book_after_fundamentals_of_data_engineering/,False,False,False,False
1kbt10i,An open-source framework to build analytical backends,22,4,Playful_Show3318,2025-04-30 22:15:45,https://www.reddit.com/r/dataengineering/comments/1kbt10i/an_opensource_framework_to_build_analytical/,False,False,False,False
1kbrxwf,What's your preferred way of viewing data in S3?,21,23,Impressive_Run8512,2025-04-30 21:29:23,https://www.reddit.com/r/dataengineering/comments/1kbrxwf/whats_your_preferred_way_of_viewing_data_in_s3/,False,False,False,False
1kc7n6p,"Data governance, is it still worth learning it in 2025?",21,16,Astherol,2025-05-01 12:35:49,https://www.reddit.com/r/dataengineering/comments/1kc7n6p/data_governance_is_it_still_worth_learning_it_in/,False,False,False,False
1kbk0y2,Why the Hard Skills Obsession Is Misleading Every Aspiring Data Engineer,13,37,ivanovyordan,2025-04-30 15:58:14,https://www.datagibberish.com/p/hard-data-engineering-skills-obsession-mistake,False,False,False,False
1kc5giw,Goodbye PyDeequ: A new take on data quality in Spark,12,6,GeneBackground4270,2025-05-01 10:30:06,https://www.reddit.com/r/dataengineering/comments/1kc5giw/goodbye_pydeequ_a_new_take_on_data_quality_in/,False,False,False,False
1kc432v,Large practice dataset,9,7,dialar77,2025-05-01 08:53:22,https://www.reddit.com/r/dataengineering/comments/1kc432v/large_practice_dataset/,False,False,False,False
1kbqgwo,What’s New in Apache Iceberg Format Version 3?,13,0,AMDataLake,2025-04-30 20:26:34,https://www.dremio.com/blog/apache-iceberg-v3/,False,False,False,False
1kc4y0x,Am I missing something?,9,14,Astherol,2025-05-01 09:55:46,https://www.reddit.com/r/dataengineering/comments/1kc4y0x/am_i_missing_something/,False,False,False,False
1kbk6o6,Career transition from data warehouse developer to data solutions architect,10,3,Mountain-Concern3967,2025-04-30 16:04:36,https://www.reddit.com/r/dataengineering/comments/1kbk6o6/career_transition_from_data_warehouse_developer/,False,False,False,False
1kc2nwb,Using Vortex to accelerate Apache Iceberg queries up to 4x,6,0,stuff_in_the_cloud,2025-05-01 07:06:59,https://spiraldb.com/post/vortex-on-ice,False,False,False,False
1kbjrbc,Figuring out the data engineering path,7,0,National_Vacation_43,2025-04-30 15:47:02,https://www.reddit.com/r/dataengineering/comments/1kbjrbc/figuring_out_the_data_engineering_path/,False,False,False,False
1kc9yjd,2 questions,7,13,sabziwala1,2025-05-01 14:22:20,https://i.redd.it/vogasdqjj6ye1.png,False,False,False,False
1kc6nud,Zero Temperature Randomness in LLMs,3,0,Martynoas,2025-05-01 11:43:40,https://martynassubonis.substack.com/p/zero-temperature-randomness-in-llms,False,False,False,False
1kc4i28,Need Help in finding resources for Apache Flink,3,1,Practical-Emu-832,2025-05-01 09:23:45,https://www.reddit.com/r/dataengineering/comments/1kc4i28/need_help_in_finding_resources_for_apache_flink/,False,False,False,False
1kbklku,Tool to manage datasets where datum can end up in multiple datasets,4,1,cheshire_squid,2025-04-30 16:21:50,https://www.reddit.com/r/dataengineering/comments/1kbklku/tool_to_manage_datasets_where_datum_can_end_up_in/,False,False,False,False
1kc1fgx,dbt and Power BI's Semantic Layer,3,0,analytical_dream,2025-05-01 05:41:52,https://www.reddit.com/r/dataengineering/comments/1kc1fgx/dbt_and_power_bis_semantic_layer/,False,False,False,False
1kbnccb,User models on the data warehouse.,3,0,Minimum-Award-5556,2025-04-30 18:14:34,https://www.reddit.com/r/dataengineering/comments/1kbnccb/user_models_on_the_data_warehouse/,False,False,False,False
1kbmit5,Low lift call of Stored Procedures in Redshift,3,3,gottapitydatfool,2025-04-30 17:40:53,https://www.reddit.com/r/dataengineering/comments/1kbmit5/low_lift_call_of_stored_procedures_in_redshift/,False,False,False,False
1kbjfrf,Databricks Notebook is failing after If Condition Fail,3,0,hijkblck93,2025-04-30 15:33:31,https://www.reddit.com/r/dataengineering/comments/1kbjfrf/databricks_notebook_is_failing_after_if_condition/,False,False,False,False
1kbtrto,How to Use Great Expectations (GX) in Azure Databricks?,2,2,Maximum_Bobcat_3451,2025-04-30 22:50:12,https://www.reddit.com/r/dataengineering/comments/1kbtrto/how_to_use_great_expectations_gx_in_azure/,False,False,False,False
1kbqsf6,Only returning the final result of a redshift call function,2,1,gottapitydatfool,2025-04-30 20:40:20,https://www.reddit.com/r/dataengineering/comments/1kbqsf6/only_returning_the_final_result_of_a_redshift/,False,False,False,False
1kc9ohq,The Open Source Analytics Conference (OSACon) CFP is now officially open!,2,0,Altinity_CristinaM,2025-05-01 14:10:16,https://www.reddit.com/r/dataengineering/comments/1kc9ohq/the_open_source_analytics_conference_osacon_cfp/,False,False,False,False
1kc9jd4,Just launched a course on building a simple AI agent with Llama + Flask – free at the moment,1,2,Kairo1004,2025-05-01 14:04:16,https://www.reddit.com/r/dataengineering/comments/1kc9jd4/just_launched_a_course_on_building_a_simple_ai/,False,False,False,False
1kbjqwm,Nielsen data sourcing,1,1,jlt77,2025-04-30 15:46:30,https://www.reddit.com/r/dataengineering/comments/1kbjqwm/nielsen_data_sourcing/,False,False,False,False
1kc6nen,Shopify GraphQL Data Ingestion,0,1,SuccessRecent8762,2025-05-01 11:42:59,https://www.reddit.com/r/dataengineering/comments/1kc6nen/shopify_graphql_data_ingestion/,False,False,False,False
1kc0t2e,"Do AI solutions help with understanding data engineering, or just automate tasks?",0,2,PuzzleheadedYou4992,2025-05-01 05:01:40,https://www.reddit.com/r/dataengineering/comments/1kc0t2e/do_ai_solutions_help_with_understanding_data/,False,False,False,False
1kbppmh,How Data Warehousing Drives Student Success and Institutional Efficiency,0,1,Data-Sleek,2025-04-30 19:54:27,https://www.reddit.com/r/dataengineering/comments/1kbppmh/how_data_warehousing_drives_student_success_and/,False,False,False,False
1kc4h9h,I'm a beginner on a scale of 1 to 10 how much would you rate this project,0,2,thetemporaryman,2025-05-01 09:22:13,https://github.com/sksj007/creditcard_fraud_detector.git,False,False,False,False
